<?xml version="1.0" encoding="UTF-8"?>
<xs:schema xmlns:xs="http://www.w3.org/2001/XMLSchema">

  <xs:element name="evNetwork">
    <xs:complexType>
      <xs:sequence>

        <xs:element name="chargingStations">
          <xs:complexType>
            <xs:sequence>
              <xs:element name="station" maxOccurs="unbounded">
                <xs:complexType>
                  <xs:sequence>
                    <xs:element name="location">
                      <xs:complexType>
                        <xs:sequence>
                          <xs:element name="latitude" type="xs:decimal"/>
                          <xs:element name="longitude" type="xs:decimal"/>
                          <xs:element name="address" type="xs:string"/>
                        </xs:sequence>
                      </xs:complexType>
                    </xs:element>
                    <xs:element name="sockets">
                      <xs:complexType>
                        <xs:sequence>
                          <xs:element name="socket" maxOccurs="unbounded">
                            <xs:complexType>
                              <xs:sequence>
                                <xs:element name="maxPower">
                                  <xs:complexType>
                                    <xs:simpleContent>
                                      <xs:extension base="xs:decimal">
                                        <xs:attribute name="unit" type="xs:string" use="required"/>
                                      </xs:extension>
                                    </xs:simpleContent>
                                  </xs:complexType>
                                </xs:element>
                                <xs:element name="status" type="xs:string"/>
                              </xs:sequence>
                              <xs:attribute name="number" type="xs:integer" use="required"/>
                              <xs:attribute name="type" type="xs:string" use="required"/>
                            </xs:complexType>
                          </xs:element>
                        </xs:sequence>
                      </xs:complexType>
                    </xs:element>
                    <xs:element name="diagnostics">
                      <xs:complexType>
                        <xs:sequence>
                          <xs:element name="code" type="xs:string" maxOccurs="unbounded"/>
                        </xs:sequence>
                      </xs:complexType>
                    </xs:element>
                  </xs:sequence>
                  <xs:attribute name="id" type="xs:integer" use="required"/>
                  <xs:attribute name="name" type="xs:string" use="required"/>
                </xs:complexType>
              </xs:element>
            </xs:sequence>
          </xs:complexType>
        </xs:element>

        <xs:element name="users">
          <xs:complexType>
            <xs:sequence>
              <xs:element name="user" maxOccurs="unbounded">
                <xs:complexType>
                  <xs:sequence>
                    <xs:element name="name" type="xs:string"/>
                    <xs:element name="email" type="xs:string"/>
                    <xs:element name="vehicle">
                      <xs:complexType>
                        <xs:sequence>
                          <xs:element name="vehicleNumber" type="xs:string"/>
                          <xs:element name="batteryCapacity">
                            <xs:complexType>
                              <xs:simpleContent>
                                <xs:extension base="xs:decimal">
                                  <xs:attribute name="unit" type="xs:string" use="required"/>
                                </xs:extension>
                              </xs:simpleContent>
                            </xs:complexType>
                          </xs:element>
                        </xs:sequence>
                        <xs:attribute name="id" type="xs:integer" use="required"/>
                      </xs:complexType>
                    </xs:element>
                  </xs:sequence>
                  <xs:attribute name="id" type="xs:integer" use="required"/>
                </xs:complexType>
              </xs:element>
            </xs:sequence>
          </xs:complexType>
        </xs:element>

        <xs:element name="chargingSessions">
          <xs:complexType>
            <xs:sequence>
              <xs:element name="session" maxOccurs="unbounded">
                <xs:complexType>
                  <xs:sequence>
                    <xs:element name="startTime" type="xs:dateTime"/>
                    <xs:element name="endTime" type="xs:dateTime" minOccurs="0"/>
                    <xs:element name="energy">
                      <xs:complexType>
                        <xs:simpleContent>
                          <xs:extension base="xs:decimal">
                            <xs:attribute name="unit" type="xs:string" use="required"/>
                          </xs:extension>
                        </xs:simpleContent>
                      </xs:complexType>
                    </xs:element>
                    <xs:element name="status" type="xs:string"/>
                  </xs:sequence>
                  <xs:attribute name="id" type="xs:integer" use="required"/>
                  <xs:attribute name="stationId" type="xs:integer" use="required"/>
                  <xs:attribute name="vehicleId" type="xs:integer" use="required"/>
                </xs:complexType>
              </xs:element>
            </xs:sequence>
          </xs:complexType>
        </xs:element>

        <xs:element name="logs">
          <xs:complexType>
            <xs:sequence>
              <xs:element name="log" maxOccurs="unbounded">
                <xs:complexType>
                  <xs:sequence>
                    <xs:element name="message" type="xs:string"/>
                  </xs:sequence>
                  <xs:attribute name="id" type="xs:integer" use="required"/>
                  <xs:attribute name="stationId" type="xs:integer" use="required"/>
                </xs:complexType>
              </xs:element>
            </xs:sequence>
          </xs:complexType>
        </xs:element>

      </xs:sequence>
      <xs:attribute name="city" type="xs:string" use="required"/>
    </xs:complexType>
  </xs:element>

</xs:schema>